{
  "schema": "provenant.graph-node-receipt.v1",
  "identity": {
    "project": "project-1",
    "graph_id": "graph-1",
    "node_id": "node-1",
    "revision": 1,
    "attempt": 1,
    "restart": 0,
    "input_attempts": {}
  },
  "spec_hash": "aaaaaaaaaaaaaaaaaaaaaaaaaaaaaaaaaaaaaaaaaaaaaaaaaaaaaaaaaaaaaaaa",
  "plan": {
    "tier": "routine",
    "mode": "read_only",
    "confidential": false
  },
  "route": {
    "requested": {},
    "pool": {},
    "line": null
  },
  "dispatch": {
    "run_id": "run-1",
    "task_id": "node-1",
    "run_dir": null
  },
  "outcome": {
    "state": "passed",
    "lane_status": "ok",
    "stale": false,
    "base_sha": null,
    "head_sha": null,
    "result_path": null,
    "gates": []
  },
  "tokens": {
    "context": null,
    "usage_source": null
  },
  "written_at": "2026-10-23T00:01:00Z"
}
